"No.","Time","Source","Destination","Protocol","Length","Info"
"1","0.000000","192.168.43.51","40.81.30.101","TLSv1.2","147","Client Key Exchange, Change Cipher Spec, Encrypted Handshake Message"
"2","0.192831","192.168.43.51","52.184.80.179","TCP","54","54185  >  443 [FIN, ACK] Seq=1 Ack=1 Win=253 Len=0"
"3","0.219215","192.168.43.51","192.168.43.255","NBNS","110","Registration NB WORKGROUP<1e>"
"4","0.261454","192.168.43.51","40.90.23.247","TLSv1.2","1424","Application Data, Application Data"
"5","0.269470","192.168.43.51","35.171.195.101","TLSv1.2","85","Encrypted Alert"
"6","0.344116","192.168.43.51","34.238.215.11","TCP","1424","54184  >  443 [ACK] Seq=1 Ack=1 Win=252 Len=1370 [TCP segment of a reassembled PDU]"
"7","0.607038","192.168.43.51","40.119.211.203","TLSv1.2","153","Application Data"
"8","0.613078","fe80::d87e:c057:2f56:733c","ff02::2","ICMPv6","70","Router Solicitation from 7c:67:a2:e6:a9:6f"
"9","0.652607","0.0.0.0","255.255.255.255","DHCP","364","DHCP Request  - Transaction ID 0xf5aa6611"
"10","0.661752","fe80::d87e:c057:2f56:733c","ff02::16","ICMPv6","90","Multicast Listener Report Message v2"
"11","0.662210","192.168.43.51","224.0.0.22","IGMPv3","54","Membership Report / Leave group 224.0.0.252"
"12","0.674806","fe80::d87e:c057:2f56:733c","ff02::16","ICMPv6","90","Multicast Listener Report Message v2"
"13","0.675012","IntelCor_e6:a9:6f","Broadcast","ARP","42","Who has 192.168.43.1? Tell 192.168.43.51"
"14","0.675059","192.168.43.51","224.0.0.22","IGMPv3","54","Membership Report / Join group 224.0.0.252 for any sources"
"15","0.676127","192.168.43.51","224.0.0.251","MDNS","81","Standard query 0x0000 ANY DESKTOP-JKUOPL4.local, ""QM"" question"
"16","0.676668","fe80::d87e:c057:2f56:733c","ff02::fb","MDNS","101","Standard query 0x0000 ANY DESKTOP-JKUOPL4.local, ""QM"" question"
"17","0.676926","192.168.43.51","224.0.0.251","MDNS","119","Standard query response 0x0000 AAAA fe80::d87e:c057:2f56:733c A 192.168.43.51"
"18","0.677195","fe80::d87e:c057:2f56:733c","ff02::fb","MDNS","139","Standard query response 0x0000 AAAA fe80::d87e:c057:2f56:733c A 192.168.43.51"
"19","0.677752","fe80::d87e:c057:2f56:733c","ff02::1:3","LLMNR","95","Standard query 0x8463 ANY DESKTOP-JKUOPL4"
"20","0.677762","Motorola_c9:f0:bd","IntelCor_e6:a9:6f","ARP","42","192.168.43.1 is at 88:b4:a6:c9:f0:bd"
"21","0.677823","192.168.43.51","192.168.43.1","DNS","83","Standard query 0x2207 A www.msftconnecttest.com"
"22","0.678228","192.168.43.51","224.0.0.252","LLMNR","75","Standard query 0x8463 ANY DESKTOP-JKUOPL4"
"23","0.678930","fe80::d87e:c057:2f56:733c","ff02::1:2","DHCPv6","157","Solicit XID: 0xb52173 CID: 0001000120f92919f48e38f34050 "
"24","0.681476","192.168.43.1","192.168.43.51","DHCP","371","DHCP ACK      - Transaction ID 0xf5aa6611"
"25","0.689032","192.168.43.1","192.168.43.51","DNS","205","Standard query response 0x2207 A www.msftconnecttest.com CNAME v4ncsi.msedge.net CNAME ncsi.4-c-0003.c-msedge.net CNAME 4-c-0003.c-msedge.net A 13.107.4.52"
"26","0.690888","fe80::d87e:c057:2f56:733c","ff02::16","ICMPv6","90","Multicast Listener Report Message v2"
"27","0.690928","192.168.43.51","224.0.0.22","IGMPv3","54","Membership Report / Leave group 224.0.0.252"
"28","0.691924","192.168.43.51","13.107.4.52","TCP","66","54187  >  80 [SYN] Seq=0 Win=64240 Len=0 MSS=1460 WS=256 SACK_PERM=1"
"29","0.706535","fe80::d87e:c057:2f56:733c","ff02::16","ICMPv6","90","Multicast Listener Report Message v2"
"30","0.706841","192.168.43.51","224.0.0.22","IGMPv3","54","Membership Report / Join group 224.0.0.252 for any sources"
"31","0.707217","fe80::d87e:c057:2f56:733c","ff02::16","ICMPv6","90","Multicast Listener Report Message v2"
"32","0.707286","192.168.43.51","224.0.0.22","IGMPv3","54","Membership Report / Leave group 224.0.0.252"
"33","0.707498","fe80::d87e:c057:2f56:733c","ff02::16","ICMPv6","90","Multicast Listener Report Message v2"
"34","0.707688","192.168.43.51","224.0.0.22","IGMPv3","54","Membership Report / Join group 224.0.0.252 for any sources"
"35","0.708560","192.168.43.51","224.0.0.251","MDNS","81","Standard query 0x0000 ANY DESKTOP-JKUOPL4.local, ""QM"" question"
"36","0.708760","fe80::d87e:c057:2f56:733c","ff02::fb","MDNS","101","Standard query 0x0000 ANY DESKTOP-JKUOPL4.local, ""QM"" question"
"37","0.708966","192.168.43.51","224.0.0.251","MDNS","119","Standard query response 0x0000 AAAA fe80::d87e:c057:2f56:733c A 192.168.43.51"
"38","0.709098","fe80::d87e:c057:2f56:733c","ff02::fb","MDNS","139","Standard query response 0x0000 AAAA fe80::d87e:c057:2f56:733c A 192.168.43.51"
"39","0.709713","fe80::d87e:c057:2f56:733c","ff02::1:3","LLMNR","95","Standard query 0x6825 ANY DESKTOP-JKUOPL4"
"40","0.710045","192.168.43.51","224.0.0.252","LLMNR","75","Standard query 0x6825 ANY DESKTOP-JKUOPL4"
"41","0.792922","13.107.4.52","192.168.43.51","TCP","66","80  >  54187 [SYN, ACK] Seq=0 Ack=1 Win=65535 Len=0 MSS=1370 WS=256 SACK_PERM=1"
"42","0.793252","192.168.43.51","13.107.4.52","TCP","54","54187  >  80 [ACK] Seq=1 Ack=1 Win=65536 Len=0"
"43","0.793511","192.168.43.51","13.107.4.52","HTTP","208","GET /connecttest.txt HTTP/1.1 "
"44","0.796933","192.168.43.51","192.168.43.1","DNS","90","Standard query 0x4a5d A mobile.pipe.aria.microsoft.com"
"45","0.799945","192.168.43.1","192.168.43.51","DNS","241","Standard query response 0x4a5d A mobile.pipe.aria.microsoft.com CNAME prd.col.aria.mobile.skypedata.akadns.net CNAME pipe.skype.com CNAME pipe.prd.skypedata.akadns.net CNAME pipe.cloudapp.aria.akadns.net A 52.114.132.21"
"46","0.801056","192.168.43.51","40.81.30.101","TCP","147","[TCP Retransmission] 54186  >  443 [PSH, ACK] Seq=1 Ack=1 Win=253 Len=93"
"47","0.806930","192.168.43.1","192.168.43.51","DNS","274","Standard query response 0x4a5d A mobile.pipe.aria.microsoft.com CNAME prd.col.aria.mobile.skypedata.akadns.net CNAME pipe.skype.com CNAME pipe.prd.skypedata.akadns.net CNAME pipe.cloudapp.aria.akadns.net A 52.114.132.21"
"48","0.806995","192.168.43.51","52.114.132.21","TCP","66","54188  >  443 [SYN] Seq=0 Win=65535 Len=0 MSS=1460 WS=256 SACK_PERM=1"
"49","0.833602","40.81.30.101","192.168.43.51","TCP","66","443  >  54186 [ACK] Seq=121 Ack=94 Win=2048 Len=0 SLE=1 SRE=94"
"50","0.836216","40.119.211.203","192.168.43.51","TLSv1.2","174","Application Data"
"51","0.839391","40.81.30.101","192.168.43.51","TCP","66","[TCP Dup ACK 49#1] 443  >  54186 [ACK] Seq=121 Ack=94 Win=2048 Len=0 SLE=1 SRE=94"
"52","0.842856","52.184.80.179","192.168.43.51","TCP","54","443  >  54185 [ACK] Seq=2 Ack=2 Win=1027 Len=0"
"53","0.844036","52.184.80.179","192.168.43.51","TCP","54","[TCP Dup ACK 52#1] 443  >  54185 [ACK] Seq=2 Ack=2 Win=1027 Len=0"
"54","0.868108","13.107.4.52","192.168.43.51","TCP","54","80  >  54187 [ACK] Seq=1 Ack=155 Win=262656 Len=0"
"55","0.874279","13.107.4.52","192.168.43.51","HTTP","568","HTTP/1.1 200 OK  (text/plain)"
"56","0.875526","192.168.43.51","13.107.4.52","TCP","54","54187  >  80 [FIN, ACK] Seq=155 Ack=515 Win=65024 Len=0"
"57","0.875875","13.107.4.52","192.168.43.51","TCP","54","80  >  54187 [FIN, ACK] Seq=515 Ack=155 Win=262656 Len=0"
"58","0.876156","192.168.43.51","13.107.4.52","TCP","54","54187  >  80 [ACK] Seq=156 Ack=516 Win=65024 Len=0"
"59","0.877655","192.168.43.51","40.119.211.203","TCP","54","54175  >  443 [ACK] Seq=100 Ack=121 Win=255 Len=0"
"60","0.929768","40.90.23.247","192.168.43.51","TCP","66","[TCP ACKed unseen segment] 443  >  54181 [ACK] Seq=1371 Ack=7557 Win=1026 Len=0 SLE=6187 SRE=7557"
"61","0.937884","34.238.215.11","192.168.43.51","TCP","66","[TCP ACKed unseen segment] 443  >  54184 [ACK] Seq=3682 Ack=1734 Win=123 Len=0 SLE=364 SRE=1734"
"62","0.941408","35.171.195.101","192.168.43.51","TCP","66","443  >  54183 [ACK] Seq=1 Ack=33 Win=130 Len=0 SLE=32 SRE=33"
"63","0.950652","40.90.23.247","192.168.43.51","TCP","66","[TCP Dup ACK 60#1] [TCP ACKed unseen segment] 443  >  54181 [ACK] Seq=1371 Ack=7557 Win=1026 Len=0 SLE=1 SRE=1371"
"64","0.951213","34.238.215.11","192.168.43.51","TCP","66","[TCP Dup ACK 61#1] [TCP ACKed unseen segment] 443  >  54184 [ACK] Seq=3682 Ack=1734 Win=123 Len=0 SLE=1 SRE=1371"
"65","0.952041","13.107.4.52","192.168.43.51","TCP","54","80  >  54187 [ACK] Seq=516 Ack=156 Win=262656 Len=0"
"66","0.953927","40.81.30.101","192.168.43.51","TCP","66","[TCP Dup ACK 49#2] 443  >  54186 [ACK] Seq=121 Ack=94 Win=2048 Len=0 SLE=1 SRE=94"
"67","0.970975","192.168.43.51","192.168.43.255","NBNS","110","Registration NB WORKGROUP<1e>"
"68","0.971637","34.238.215.11","192.168.43.51","TCP","1424","[TCP ACKed unseen segment] [TCP Retransmission] 443  >  54184 [ACK] Seq=1 Ack=1734 Win=123 Len=1370"
"69","1.012950","192.168.43.51","34.238.215.11","TCP","54","[TCP Previous segment not captured] 54184  >  443 [ACK] Seq=1734 Ack=1371 Win=256 Len=0"
"70","1.112144","IntelCor_e6:a9:6f","Broadcast","ARP","42","Who has 192.168.43.51? Tell 0.0.0.0"
"71","1.112386","192.168.43.51","224.0.0.22","IGMPv3","70","Membership Report / Join group 224.0.0.251 for any sources / Join group 239.255.255.250 for any sources / Join group 224.0.0.252 for any sources"
"72","1.112485","::","ff02::1:ff56:733c","ICMPv6","78","Neighbor Solicitation for fe80::d87e:c057:2f56:733c"
"73","1.112531","fe80::d87e:c057:2f56:733c","ff02::2","ICMPv6","62","Router Solicitation"
"74","1.112565","fe80::d87e:c057:2f56:733c","ff02::16","ICMPv6","150","Multicast Listener Report Message v2"
"75","1.165248","40.81.30.101","192.168.43.51","TCP","174","[TCP Retransmission] 443  >  54186 [PSH, ACK] Seq=1 Ack=94 Win=2048 Len=120"
"76","1.166260","192.168.43.51","40.81.30.101","TLSv1.2","141","Application Data"
"77","1.166591","192.168.43.51","40.81.30.101","TLSv1.2","202","Application Data"
"78","1.166673","192.168.43.51","40.81.30.101","TLSv1.2","92","Application Data"
"79","1.166950","52.114.132.21","192.168.43.51","TCP","66","443  >  54188 [SYN, ACK] Seq=0 Ack=1 Win=8192 Len=0 MSS=1370 WS=256 SACK_PERM=1"
"80","1.167098","192.168.43.51","52.114.132.21","TCP","54","54188  >  443 [ACK] Seq=1 Ack=1 Win=262144 Len=0"
"81","1.172358","192.168.43.51","52.114.132.21","TLSv1.2","245","Client Hello"
"82","1.299860","34.238.215.11","192.168.43.51","TCP","1424","[TCP ACKed unseen segment] [TCP Retransmission] 443  >  54184 [ACK] Seq=1371 Ack=1734 Win=123 Len=1370"
"83","1.303057","34.238.215.11","192.168.43.51","TCP","995","[TCP Retransmission] 443  >  54184 [PSH, ACK] Seq=2741 Ack=1734 Win=123 Len=941"
"84","1.304223","192.168.43.51","34.238.215.11","TCP","54","54184  >  443 [FIN, ACK] Seq=1734 Ack=3682 Win=256 Len=0"
"85","1.304303","192.168.43.51","34.238.215.11","TCP","54","[TCP Keep-Alive] 54184  >  443 [ACK] Seq=1734 Ack=3682 Win=256 Len=0"
"86","1.326599","13.231.11.98","192.168.43.51","TCP","1354","443  >  54180 [ACK] Seq=1 Ack=1 Win=28770 Len=1300 [TCP segment of a reassembled PDU]"
"87","1.367012","192.168.43.51","13.231.11.98","TCP","54","54180  >  443 [ACK] Seq=1 Ack=1301 Win=64390 Len=0"
"88","1.525765","192.168.43.51","192.168.43.1","DNS","87","Standard query 0x016b A na1e-acc.services.adobe.com"
"89","1.532120","192.168.43.1","192.168.43.51","DNS","363","Standard query response 0x016b A na1e-acc.services.adobe.com CNAME na1e.services.adobe.com CNAME na1e.adobe-identity.com CNAME ets-prd1-ue1-coll-elb-1597281203.us-east-1.elb.amazonaws.com A 54.236.74.232 A 54.156.197.162 A 54.88.120.59 A 54.85.222.236 A 107.23.79.131 A 52.23.39.23 A 54.86.220.206 A 35.171.195.101"
"90","1.533241","192.168.43.51","54.236.74.232","TCP","66","54189  >  443 [SYN] Seq=0 Win=64240 Len=0 MSS=1460 WS=256 SACK_PERM=1"
"91","1.571163","40.81.30.101","192.168.43.51","TCP","54","443  >  54186 [ACK] Seq=121 Ack=367 Win=2047 Len=0"
"92","1.571166","40.81.30.101","192.168.43.51","TLSv1.2","92","Application Data"
"93","1.576191","40.81.30.101","192.168.43.51","TLSv1.2","256","Application Data"
"94","1.577417","192.168.43.51","40.81.30.101","TCP","54","54186  >  443 [ACK] Seq=367 Ack=361 Win=252 Len=0"
"95","1.577573","40.81.30.101","192.168.43.51","TCP","54","443  >  54178 [FIN, ACK] Seq=1 Ack=1 Win=2047 Len=0"
"96","1.577624","192.168.43.51","40.81.30.101","TCP","54","[TCP ZeroWindow] 54178  >  443 [ACK] Seq=1 Ack=2 Win=0 Len=0"
"97","1.579363","192.168.43.51","192.168.43.1","DNS","76","Standard query 0x5781 A oneclient.sfx.ms"
"98","1.613144","192.168.43.51","224.0.0.22","IGMPv3","62","Membership Report / Join group 224.0.0.251 for any sources / Join group 239.255.255.250 for any sources"
"99","1.613380","fe80::d87e:c057:2f56:733c","ff02::16","ICMPv6","130","Multicast Listener Report Message v2"
"100","1.626339","192.168.43.51","192.168.43.1","DNS","80","Standard query 0x2577 A cc-api-data.adobe.io"
"101","1.630253","192.168.43.1","192.168.43.51","DNS","208","Standard query response 0x2577 A cc-api-data.adobe.io A 54.178.246.91 A 52.69.143.92 A 54.250.80.23 A 54.248.51.177 A 54.249.16.53 A 52.198.148.44 A 52.68.71.74 A 54.248.211.143"
"102","1.631697","192.168.43.51","54.178.246.91","TCP","66","54190  >  443 [SYN] Seq=0 Win=64240 Len=0 MSS=1460 WS=256 SACK_PERM=1"
"103","1.645350","192.168.43.51","192.168.43.1","DNS","73","Standard query 0xa548 A p13n.adobe.io"
"104","1.660772","52.114.132.21","192.168.43.51","TCP","1424","443  >  54188 [ACK] Seq=1 Ack=192 Win=262912 Len=1370 [TCP segment of a reassembled PDU]"
"105","1.664337","192.168.43.51","52.114.132.21","TCP","54","54188  >  443 [ACK] Seq=192 Ack=1371 Win=262144 Len=0"
"106","1.664814","52.114.132.21","192.168.43.51","TCP","1424","443  >  54188 [ACK] Seq=1371 Ack=192 Win=262912 Len=1370 [TCP segment of a reassembled PDU]"
"107","1.665854","192.168.43.51","52.114.132.21","TCP","54","54188  >  443 [ACK] Seq=192 Ack=2741 Win=262144 Len=0"
"108","1.679342","fe80::d87e:c057:2f56:733c","ff02::1:2","DHCPv6","157","Solicit XID: 0xb52173 CID: 0001000120f92919f48e38f34050 "
"109","1.693128","192.168.43.51","192.168.43.1","DNS","82","Standard query 0x3458 A ims-na1.adobelogin.com"
"110","1.702183","52.114.132.21","192.168.43.51","TCP","1424","443  >  54188 [ACK] Seq=2741 Ack=192 Win=262912 Len=1370 [TCP segment of a reassembled PDU]"
"111","1.702187","192.168.43.1","192.168.43.51","DNS","258","Standard query response 0x3458 A ims-na1.adobelogin.com CNAME adobelogin.prod.ims.adobejanus.com A 3.224.218.162 A 54.175.231.56 A 54.172.255.36 A 18.205.11.218 A 3.222.68.239 A 3.224.250.45 A 3.225.123.79 A 52.86.166.225"
"112","1.707424","192.168.43.51","3.224.218.162","TCP","66","54191  >  443 [SYN] Seq=0 Win=64240 Len=0 MSS=1460 WS=256 SACK_PERM=1"
"113","1.708864","192.168.43.51","52.114.132.21","TCP","54","54188  >  443 [ACK] Seq=192 Ack=4111 Win=262144 Len=0"
"114","1.725192","192.168.43.51","192.168.43.255","BROWSER","228","Request Announcement DESKTOP-JKUOPL4"
"115","1.725397","52.114.132.21","192.168.43.51","TCP","1424","443  >  54188 [ACK] Seq=4111 Ack=192 Win=262912 Len=1370 [TCP segment of a reassembled PDU]"
"116","1.725766","192.168.43.51","52.114.132.21","TCP","54","54188  >  443 [ACK] Seq=192 Ack=5481 Win=262144 Len=0"
"117","1.726803","52.114.132.21","192.168.43.51","TLSv1.2","620","Server Hello, Certificate, Certificate Status, Server Key Exchange, Server Hello Done"
"118","1.727442","192.168.43.51","52.114.132.21","TCP","54","54188  >  443 [ACK] Seq=192 Ack=6047 Win=261376 Len=0"
"119","1.727746","13.231.11.98","192.168.43.51","TLSv1.2","720","Application Data, Encrypted Alert"
"120","1.731748","192.168.43.51","13.231.11.98","TLSv1.2","85","Encrypted Alert"
"121","1.731878","34.238.215.11","192.168.43.51","TLSv1.2","85","Encrypted Alert"
"122","1.731879","34.238.215.11","192.168.43.51","TCP","54","443  >  54184 [FIN, ACK] Seq=3713 Ack=1735 Win=123 Len=0"
"123","1.731879","34.238.215.11","192.168.43.51","TCP","54","[TCP Keep-Alive ACK] 443  >  54184 [ACK] Seq=3714 Ack=1735 Win=123 Len=0"
"124","1.731879","52.184.80.179","192.168.43.51","TCP","54","[TCP Retransmission] 443  >  54185 [FIN, ACK] Seq=1 Ack=2 Win=1027 Len=0"
"125","1.731880","192.168.43.1","192.168.43.51","DNS","170","Standard query response 0x5781 A oneclient.sfx.ms CNAME oneclient.sfx.ms.edgekey.net CNAME e9659.dspg.akamaiedge.net A 49.44.205.119"
"126","1.731880","192.168.43.1","192.168.43.51","DNS","201","Standard query response 0xa548 A p13n.adobe.io A 52.203.168.176 A 52.204.83.172 A 52.206.248.246 A 52.206.176.2 A 52.21.200.19 A 52.207.164.253 A 52.203.189.247 A 52.206.203.213"
"127","1.732029","192.168.43.51","13.231.11.98","TCP","54","54180  >  443 [FIN, ACK] Seq=32 Ack=1967 Win=63724 Len=0"
"128","1.732570","192.168.43.51","34.238.215.11","TCP","54","54184  >  443 [RST, ACK] Seq=1735 Ack=3713 Win=0 Len=0"
"129","1.734179","192.168.43.51","49.44.205.119","TCP","66","54192  >  443 [SYN] Seq=0 Win=64240 Len=0 MSS=1460 WS=256 SACK_PERM=1"
"130","1.734243","192.168.43.51","52.203.168.176","TCP","66","54193  >  443 [SYN] Seq=0 Win=65535 Len=0 MSS=1460 WS=256 SACK_PERM=1"
"131","1.740143","192.168.43.51","192.168.43.255","BROWSER","249","Host Announcement DESKTOP-JKUOPL4, Workstation, Server, NT Workstation, Potential Browser"
"132","1.750850","192.168.43.51","192.168.43.1","DNS","78","Standard query 0x3661 A cc-collab.adobe.io"
"133","1.773622","192.168.43.51","192.168.43.1","DNS","83","Standard query 0x6272 A cc-api-storage.adobe.io"
"134","1.777945","192.168.43.1","192.168.43.51","DNS","211","Standard query response 0x6272 A cc-api-storage.adobe.io A 13.231.86.235 A 13.230.98.44 A 52.196.16.111 A 52.193.161.235 A 52.199.221.51 A 3.113.73.134 A 52.193.34.8 A 13.231.11.98"
"135","1.778566","192.168.43.51","52.114.132.21","TLSv1.2","147","Client Key Exchange, Change Cipher Spec, Encrypted Handshake Message"
"136","1.779249","192.168.43.51","13.231.86.235","TCP","66","54194  >  443 [SYN] Seq=0 Win=64240 Len=0 MSS=1460 WS=256 SACK_PERM=1"
"137","1.946759","54.236.74.232","192.168.43.51","TCP","66","443  >  54189 [SYN, ACK] Seq=0 Ack=1 Win=26883 Len=0 MSS=1370 SACK_PERM=1 WS=256"
"138","1.947102","192.168.43.51","54.236.74.232","TCP","54","54189  >  443 [ACK] Seq=1 Ack=1 Win=65536 Len=0"
"139","1.947744","49.44.205.119","192.168.43.51","TCP","66","443  >  54192 [SYN, ACK] Seq=0 Ack=1 Win=29200 Len=0 MSS=1370 SACK_PERM=1 WS=128"
"140","1.947906","192.168.43.51","54.236.74.232","TLSv1.2","242","Client Hello"
"141","1.948116","192.168.43.51","49.44.205.119","TCP","54","54192  >  443 [ACK] Seq=1 Ack=1 Win=65536 Len=0"
"142","1.948455","192.168.43.51","49.44.205.119","TLSv1.2","249","Client Hello"
"143","1.951539","54.178.246.91","192.168.43.51","TCP","58","443  >  54190 [SYN, ACK] Seq=0 Ack=1 Win=26883 Len=0 MSS=1370"
"144","1.951757","192.168.43.51","54.178.246.91","TCP","54","54190  >  443 [ACK] Seq=1 Ack=1 Win=64240 Len=0"
"145","1.952311","192.168.43.51","54.178.246.91","TLSv1.2","235","Client Hello"
"146","1.995942","40.90.23.247","192.168.43.51","TCP","1424","[TCP ACKed unseen segment] [TCP Retransmission] 443  >  54181 [PSH, ACK] Seq=1 Ack=7557 Win=1026 Len=1370"
"147","1.996622","192.168.43.1","192.168.43.51","DNS","206","Standard query response 0x3661 A cc-collab.adobe.io A 52.193.161.235 A 13.230.98.44 A 13.231.11.98 A 52.199.221.51 A 52.193.34.8 A 3.113.73.134 A 52.196.16.111 A 13.231.86.235"
"148","1.996622","13.231.11.98","192.168.43.51","TCP","54","[TCP Dup ACK 86#1] 443  >  54180 [ACK] Seq=1967 Ack=1 Win=28770 Len=0"
"149","1.996888","13.231.11.98","192.168.43.51","TCP","54","443  >  54180 [ACK] Seq=1967 Ack=33 Win=28770 Len=0"
"150","1.997194","13.231.11.98","192.168.43.51","TCP","54","443  >  54180 [FIN, ACK] Seq=1967 Ack=33 Win=28770 Len=0"
"151","1.997584","13.231.86.235","192.168.43.51","TCP","58","443  >  54194 [SYN, ACK] Seq=0 Ack=1 Win=26883 Len=0 MSS=1370"
"152","1.997793","192.168.43.51","13.231.86.235","TCP","54","54194  >  443 [ACK] Seq=1 Ack=1 Win=64240 Len=0"
"153","1.997994","192.168.43.51","52.193.161.235","TCP","66","54195  >  443 [SYN] Seq=0 Win=64240 Len=0 MSS=1460 WS=256 SACK_PERM=1"
"154","1.998203","3.224.218.162","192.168.43.51","TCP","58","443  >  54191 [SYN, ACK] Seq=0 Ack=1 Win=26883 Len=0 MSS=1370"
"155","1.998420","192.168.43.51","3.224.218.162","TCP","54","54191  >  443 [ACK] Seq=1 Ack=1 Win=64240 Len=0"
"156","1.998506","192.168.43.51","13.231.86.235","TLSv1.2","338","Client Hello"
"157","2.000577","192.168.43.51","3.224.218.162","TLSv1.2","237","Client Hello"
"158","2.013710","52.203.168.176","192.168.43.51","TCP","66","443  >  54193 [SYN, ACK] Seq=0 Ack=1 Win=26883 Len=0 MSS=1370 SACK_PERM=1 WS=256"
"159","2.014495","192.168.43.51","52.203.168.176","TCP","54","54193  >  443 [ACK] Seq=1 Ack=1 Win=262144 Len=0"
"160","2.015839","192.168.43.51","52.203.168.176","TLSv1.2","228","Client Hello"
"161","2.026190","49.44.205.119","192.168.43.51","TCP","54","443  >  54192 [ACK] Seq=1 Ack=196 Win=30336 Len=0"
"162","2.029466","49.44.205.119","192.168.43.51","TLSv1.2","1424","Server Hello"
"163","2.029466","49.44.205.119","192.168.43.51","TCP","1424","443  >  54192 [ACK] Seq=1371 Ack=196 Win=30336 Len=1370 [TCP segment of a reassembled PDU]"
"164","2.029783","192.168.43.51","49.44.205.119","TCP","54","54192  >  443 [ACK] Seq=196 Ack=2741 Win=65536 Len=0"
"165","2.035940","192.168.43.51","40.90.23.247","TCP","54","[TCP Previous segment not captured] 54181  >  443 [ACK] Seq=7557 Ack=1371 Win=256 Len=0"
"166","2.057071","49.44.205.119","192.168.43.51","TCP","1410","443  >  54192 [PSH, ACK] Seq=2741 Ack=196 Win=30336 Len=1356 [TCP segment of a reassembled PDU]"
"167","2.081720","49.44.205.119","192.168.43.51","TLSv1.2","1424","Certificate [TCP segment of a reassembled PDU]"
"168","2.081722","52.114.132.21","192.168.43.51","TLSv1.2","105","Change Cipher Spec, Encrypted Handshake Message"
"169","2.082354","192.168.43.51","52.114.132.21","TCP","54","54188  >  443 [ACK] Seq=285 Ack=6098 Win=261376 Len=0"
"170","2.083666","192.168.43.51","49.44.205.119","TCP","54","54192  >  443 [ACK] Seq=196 Ack=5467 Win=65536 Len=0"
"171","2.087968","192.168.43.51","52.114.132.21","TLSv1.2","603","Application Data"
"172","2.089104","192.168.43.51","52.114.132.21","TCP","1424","54188  >  443 [ACK] Seq=834 Ack=6098 Win=261376 Len=1370 [TCP segment of a reassembled PDU]"
"173","2.089110","192.168.43.51","52.114.132.21","TLSv1.2","1024","Application Data"
"174","2.108300","49.44.205.119","192.168.43.51","TLSv1.2","1424","Certificate Status [TCP segment of a reassembled PDU]"
"175","2.110772","49.44.205.119","192.168.43.51","TLSv1.2","209","Server Key Exchange, Server Hello Done"
"176","2.111362","192.168.43.51","49.44.205.119","TCP","54","54192  >  443 [ACK] Seq=196 Ack=6992 Win=65536 Len=0"
"177","2.112512","IntelCor_e6:a9:6f","Broadcast","ARP","42","Who has 192.168.43.51? Tell 0.0.0.0"
"178","2.112779","fe80::d87e:c057:2f56:733c","ff02::1","ICMPv6","86","Neighbor Advertisement fe80::d87e:c057:2f56:733c (ovr) is at 7c:67:a2:e6:a9:6f"
"179","2.117243","192.168.43.51","49.44.205.119","TLSv1.2","180","Client Key Exchange, Change Cipher Spec, Encrypted Handshake Message"
"180","2.344280","54.178.246.91","192.168.43.51","TCP","54","443  >  54190 [ACK] Seq=1 Ack=182 Win=26800 Len=0"
"181","2.380373","54.178.246.91","192.168.43.51","TLSv1.2","1354","Server Hello"
"182","2.380373","54.178.246.91","192.168.43.51","TCP","1354","443  >  54190 [ACK] Seq=1301 Ack=182 Win=26800 Len=1300 [TCP segment of a reassembled PDU]"
"183","2.380677","192.168.43.51","54.178.246.91","TCP","54","54190  >  443 [ACK] Seq=182 Ack=2601 Win=64390 Len=0"
"184","2.412071","54.178.246.91","192.168.43.51","TLSv1.2","1195","Certificate, Server Key Exchange, Server Hello Done"
"185","2.413078","13.231.86.235","192.168.43.51","TCP","54","443  >  54194 [ACK] Seq=1 Ack=285 Win=26800 Len=0"
"186","2.413308","52.193.161.235","192.168.43.51","TCP","58","443  >  54195 [SYN, ACK] Seq=0 Ack=1 Win=26883 Len=0 MSS=1370"
"187","2.413740","192.168.43.51","52.193.161.235","TCP","54","54195  >  443 [ACK] Seq=1 Ack=1 Win=64240 Len=0"
"188","2.414300","192.168.43.51","52.193.161.235","TLSv1.2","301","Client Hello"
"189","2.415139","192.168.43.51","54.178.246.91","TLSv1.2","180","Client Key Exchange, Change Cipher Spec, Encrypted Handshake Message"
"190","2.437182","13.231.86.235","192.168.43.51","TLSv1.2","1354","Server Hello"
"191","2.438947","13.231.86.235","192.168.43.51","TCP","1354","443  >  54194 [ACK] Seq=1301 Ack=285 Win=26800 Len=1300 [TCP segment of a reassembled PDU]"
"192","2.439175","192.168.43.51","13.231.86.235","TCP","54","54194  >  443 [ACK] Seq=285 Ack=2601 Win=64390 Len=0"
"193","2.441543","13.231.86.235","192.168.43.51","TLSv1.2","1195","Certificate, Server Key Exchange, Server Hello Done"
"194","2.445591","192.168.43.51","13.231.86.235","TLSv1.2","180","Client Key Exchange, Change Cipher Spec, Encrypted Handshake Message"
"195","2.464270","49.44.205.119","192.168.43.51","TLSv1.2","312","New Session Ticket, Change Cipher Spec, Encrypted Handshake Message"
"196","2.464273","54.236.74.232","192.168.43.51","TCP","54","443  >  54189 [ACK] Seq=1 Ack=189 Win=28160 Len=0"
"197","2.465395","192.168.43.51","49.44.205.119","TLSv1.2","261","Application Data"
"198","2.466092","54.236.74.232","192.168.43.51","TLSv1.2","1424","Server Hello"
"199","2.467693","54.236.74.232","192.168.43.51","TCP","1424","443  >  54189 [ACK] Seq=1371 Ack=189 Win=28160 Len=1370 [TCP segment of a reassembled PDU]"
"200","2.468029","192.168.43.51","54.236.74.232","TCP","54","54189  >  443 [ACK] Seq=189 Ack=2741 Win=65536 Len=0"
"201","2.506195","54.236.74.232","192.168.43.51","TLSv1.2","1424","Certificate [TCP segment of a reassembled PDU]"
"202","2.506196","54.236.74.232","192.168.43.51","TLSv1.2","263","Server Key Exchange, Server Hello Done"
"203","2.506197","3.224.218.162","192.168.43.51","TCP","54","443  >  54191 [ACK] Seq=1 Ack=184 Win=26800 Len=0"
"204","2.507373","192.168.43.51","54.236.74.232","TCP","54","54189  >  443 [ACK] Seq=189 Ack=4320 Win=65536 Len=0"
"205","2.507777","3.224.218.162","192.168.43.51","TLSv1.2","1354","Server Hello"
"206","2.510086","192.168.43.51","54.236.74.232","TLSv1.2","180","Client Key Exchange, Change Cipher Spec, Encrypted Handshake Message"
"207","2.540532","3.224.218.162","192.168.43.51","TCP","1354","443  >  54191 [ACK] Seq=1301 Ack=184 Win=26800 Len=1300 [TCP segment of a reassembled PDU]"
"208","2.540847","192.168.43.51","3.224.218.162","TCP","54","54191  >  443 [ACK] Seq=184 Ack=2601 Win=64390 Len=0"
"209","2.557923","3.224.218.162","192.168.43.51","TCP","1354","443  >  54191 [ACK] Seq=2601 Ack=184 Win=26800 Len=1300 [TCP segment of a reassembled PDU]"
"210","2.557924","3.224.218.162","192.168.43.51","TLSv1.2","476","Certificate, Server Key Exchange, Server Hello Done"
"211","2.558364","192.168.43.51","3.224.218.162","TCP","54","54191  >  443 [ACK] Seq=184 Ack=4323 Win=64390 Len=0"
"212","2.560006","52.203.168.176","192.168.43.51","TCP","54","443  >  54193 [ACK] Seq=1 Ack=175 Win=28160 Len=0"
"213","2.560789","192.168.43.51","3.224.218.162","TLSv1.2","180","Client Key Exchange, Change Cipher Spec, Encrypted Handshake Message"
"214","2.571497","52.203.168.176","192.168.43.51","TLSv1.2","1424","Server Hello"
"215","2.572655","192.168.43.51","52.203.168.176","TCP","54","54193  >  443 [ACK] Seq=175 Ack=1371 Win=262144 Len=0"
"216","2.605469","52.203.168.176","192.168.43.51","TCP","1424","443  >  54193 [ACK] Seq=1371 Ack=175 Win=28160 Len=1370 [TCP segment of a reassembled PDU]"
"217","2.605471","52.203.168.176","192.168.43.51","TLSv1.2","1055","Certificate, Server Key Exchange, Server Hello Done"
"218","2.606702","192.168.43.51","52.203.168.176","TCP","54","54193  >  443 [ACK] Seq=175 Ack=2741 Win=262144 Len=0"
"219","2.607218","192.168.43.51","52.203.168.176","TCP","54","54193  >  443 [ACK] Seq=175 Ack=3742 Win=261120 Len=0"
"220","2.608001","40.90.23.247","192.168.43.51","TLSv1.2","1424","[TCP ACKed unseen segment] , Ignored Unknown Record"
"221","2.625968","192.168.43.51","52.203.168.176","TLSv1.2","180","Client Key Exchange, Change Cipher Spec, Encrypted Handshake Message"
"222","2.641319","40.90.23.247","192.168.43.51","TLSv1.2","1424","Ignored Unknown Record"
"223","2.641319","52.114.132.21","192.168.43.51","TCP","54","443  >  54188 [ACK] Seq=6098 Ack=2204 Win=262912 Len=0"
"224","2.641756","192.168.43.51","40.90.23.247","TCP","54","54181  >  443 [ACK] Seq=7557 Ack=4111 Win=256 Len=0"
"225","2.641945","52.114.132.21","192.168.43.51","TLSv1.2","480","Application Data"
"226","2.642250","192.168.43.51","52.114.132.21","TCP","54","54188  >  443 [ACK] Seq=3174 Ack=6524 Win=260864 Len=0"
"227","2.649898","192.168.43.51","52.114.132.21","TLSv1.2","587","Application Data"
"228","2.650133","192.168.43.51","52.114.132.21","TLSv1.2","1288","Application Data"
"229","2.652188","192.168.43.51","52.114.132.21","TCP","66","54196  >  443 [SYN] Seq=0 Win=65535 Len=0 MSS=1460 WS=256 SACK_PERM=1"
"230","2.873407","49.44.205.119","192.168.43.51","TLSv1.2","352","Application Data"
"231","2.873409","52.193.161.235","192.168.43.51","TCP","54","443  >  54195 [ACK] Seq=1 Ack=248 Win=26800 Len=0"
"232","2.874104","54.178.246.91","192.168.43.51","TLSv1.2","105","Change Cipher Spec, Encrypted Handshake Message"
"233","2.876187","192.168.43.51","54.178.246.91","TCP","1424","54190  >  443 [ACK] Seq=308 Ack=3793 Win=63198 Len=1370 [TCP segment of a reassembled PDU]"
"234","2.876188","192.168.43.51","54.178.246.91","TLSv1.2","227","Application Data"
"235","2.876737","192.168.43.51","54.178.246.91","TLSv1.2","1111","Application Data"
"236","2.886904","192.168.43.51","40.81.30.101","TLSv1.2","124","Application Data"
"237","2.901429","52.193.161.235","192.168.43.51","TLSv1.2","1354","Server Hello"
"238","2.901429","52.193.161.235","192.168.43.51","TCP","1354","443  >  54195 [ACK] Seq=1301 Ack=248 Win=26800 Len=1300 [TCP segment of a reassembled PDU]"
"239","2.901975","192.168.43.51","52.193.161.235","TCP","54","54195  >  443 [ACK] Seq=248 Ack=2601 Win=64390 Len=0"
"240","2.902209","52.193.161.235","192.168.43.51","TLSv1.2","1195","Certificate, Server Key Exchange, Server Hello Done"
"241","2.902210","13.231.86.235","192.168.43.51","TLSv1.2","105","Change Cipher Spec, Encrypted Handshake Message"
"242","2.909340","192.168.43.51","52.193.161.235","TLSv1.2","180","Client Key Exchange, Change Cipher Spec, Encrypted Handshake Message"
"243","2.910284","192.168.43.51","13.231.86.235","TCP","1424","54194  >  443 [ACK] Seq=411 Ack=3793 Win=63198 Len=1370 [TCP segment of a reassembled PDU]"
"244","2.910286","192.168.43.51","13.231.86.235","TLSv1.2","261","Application Data"
"245","2.914107","192.168.43.51","49.44.205.119","TCP","54","54192  >  443 [ACK] Seq=529 Ack=7548 Win=65024 Len=0"
"246","2.943866","54.236.74.232","192.168.43.51","TLSv1.2","328","New Session Ticket, Change Cipher Spec, Encrypted Handshake Message"
"247","2.943867","3.224.218.162","192.168.43.51","TLSv1.2","105","Change Cipher Spec, Encrypted Handshake Message"
"248","2.943867","52.203.168.176","192.168.43.51","TLSv1.2","105","Change Cipher Spec, Encrypted Handshake Message"
"249","2.943868","40.90.23.247","192.168.43.51","TLSv1.2","1424","Ignored Unknown Record"
"250","2.944627","192.168.43.51","52.203.168.176","TCP","54","54193  >  443 [ACK] Seq=301 Ack=3793 Win=260864 Len=0"
"251","2.945927","192.168.43.51","52.203.168.176","TCP","1424","54193  >  443 [ACK] Seq=301 Ack=3793 Win=260864 Len=1370 [TCP segment of a reassembled PDU]"
"252","2.945929","192.168.43.51","52.203.168.176","TLSv1.2","304","Application Data"
"253","2.946570","192.168.43.51","54.236.74.232","TLSv1.2","246","Application Data"
"254","2.946766","192.168.43.51","54.236.74.232","TCP","1424","54189  >  443 [ACK] Seq=507 Ack=4594 Win=65280 Len=1370 [TCP segment of a reassembled PDU]"
"255","2.946768","192.168.43.51","54.236.74.232","TLSv1.2","771","Application Data"
"256","2.968831","192.168.43.51","3.224.218.162","TLSv1.2","331","Application Data"
"257","2.969044","192.168.43.51","3.224.218.162","TLSv1.2","1272","Application Data"
"258","2.976850","40.90.23.247","192.168.43.51","TLSv1.2","1424","Ignored Unknown Record"
"259","2.977213","192.168.43.51","40.90.23.247","TCP","54","54181  >  443 [ACK] Seq=7557 Ack=6851 Win=256 Len=0"
"260","2.983149","40.90.23.247","192.168.43.51","TLSv1.2","1424","Ignored Unknown Record"
"261","2.983711","52.114.132.21","192.168.43.51","TLSv1.2","108","Application Data"
"262","2.983712","52.114.132.21","192.168.43.51","TLSv1.2","480","Application Data"
"263","2.983714","52.114.132.21","192.168.43.51","TCP","66","443  >  54196 [SYN, ACK] Seq=0 Ack=1 Win=8192 Len=0 MSS=1370 WS=256 SACK_PERM=1"
"264","2.983970","192.168.43.51","52.114.132.21","TCP","54","54196  >  443 [ACK] Seq=1 Ack=1 Win=262144 Len=0"
"265","2.984375","192.168.43.51","52.114.132.21","TCP","54","54188  >  443 [ACK] Seq=4941 Ack=6578 Win=260864 Len=0"
"266","2.984442","192.168.43.51","52.114.132.21","TCP","54","54188  >  443 [ACK] Seq=4941 Ack=7004 Win=262144 Len=0"
"267","2.984693","192.168.43.51","52.114.132.21","TLSv1.2","277","Client Hello"
"268","3.023900","192.168.43.51","40.90.23.247","TCP","54","54181  >  443 [ACK] Seq=7557 Ack=8221 Win=256 Len=0"
"269","3.112513","IntelCor_e6:a9:6f","Broadcast","ARP","42","Who has 192.168.43.51? Tell 0.0.0.0"
"270","3.226239","192.168.43.51","192.168.43.255","BROWSER","228","Request Announcement DESKTOP-JKUOPL4"
"271","3.236024","40.81.30.101","192.168.43.51","TLSv1.2","133","Application Data"
"272","3.236917","54.178.246.91","192.168.43.51","TCP","54","443  >  54190 [ACK] Seq=3793 Ack=1851 Win=30140 Len=0"
"273","3.236918","54.178.246.91","192.168.43.51","TLSv1.2","314","Application Data"
"274","3.236919","54.178.246.91","192.168.43.51","TLSv1.2","85","Encrypted Alert"
"275","3.236920","52.193.161.235","192.168.43.51","TLSv1.2","105","Change Cipher Spec, Encrypted Handshake Message"
"276","3.236921","13.231.86.235","192.168.43.51","TCP","54","443  >  54194 [ACK] Seq=3793 Ack=1988 Win=31510 Len=0"
"277","3.238368","192.168.43.51","54.178.246.91","TCP","54","[TCP Previous segment not captured] 54190  >  443 [FIN, ACK] Seq=2939 Ack=4084 Win=64390 Len=0"
"278","3.238384","192.168.43.51","54.178.246.91","TCP","54","54190  >  443 [ACK] Seq=2908 Ack=4084 Win=64390 Len=0"
"279","3.238997","192.168.43.51","54.178.246.91","TCP","85","[TCP Out-Of-Order] 54190  >  443 [PSH, ACK] Seq=2908 Ack=4084 Win=64390 Len=31"
"280","3.239480","192.168.43.51","49.44.205.119","TLSv1.2","312","Application Data"
"281","3.239937","192.168.43.51","52.193.161.235","TCP","1424","54195  >  443 [ACK] Seq=374 Ack=3793 Win=63198 Len=1370 [TCP segment of a reassembled PDU]"
"282","3.239938","192.168.43.51","52.193.161.235","TLSv1.2","146","Application Data"
"283","3.275742","54.236.74.232","192.168.43.51","TCP","54","443  >  54189 [ACK] Seq=4594 Ack=1877 Win=32000 Len=0"
"284","3.276988","192.168.43.51","40.81.30.101","TCP","54","54186  >  443 [ACK] Seq=437 Ack=440 Win=251 Len=0"
"285","3.303247","40.90.23.247","192.168.43.51","TLSv1.2","1424","Ignored Unknown Record"
"286","3.309919","40.90.23.247","192.168.43.51","TLSv1.2","1424","Ignored Unknown Record"
"287","3.310489","192.168.43.51","40.90.23.247","TCP","54","54181  >  443 [ACK] Seq=7557 Ack=10961 Win=256 Len=0"
"288","3.310689","52.203.168.176","192.168.43.51","TCP","54","443  >  54193 [ACK] Seq=3793 Ack=1921 Win=31232 Len=0"
"289","3.310690","3.224.218.162","192.168.43.51","TCP","54","443  >  54191 [ACK] Seq=4374 Ack=1805 Win=30450 Len=0"
"290","3.340272","52.114.132.21","192.168.43.51","TCP","1424","443  >  54196 [ACK] Seq=1 Ack=224 Win=262912 Len=1370 [TCP segment of a reassembled PDU]"
"291","3.340686","192.168.43.51","52.114.132.21","TCP","54","54196  >  443 [ACK] Seq=224 Ack=1371 Win=262144 Len=0"
"292","3.341499","52.114.132.21","192.168.43.51","TCP","1424","443  >  54196 [ACK] Seq=1371 Ack=224 Win=262912 Len=1370 [TCP segment of a reassembled PDU]"
"293","3.341500","52.114.132.21","192.168.43.51","TCP","1424","443  >  54196 [ACK] Seq=2741 Ack=224 Win=262912 Len=1370 [TCP segment of a reassembled PDU]"
"294","3.341864","192.168.43.51","52.114.132.21","TCP","54","54196  >  443 [ACK] Seq=224 Ack=4111 Win=262144 Len=0"
"295","3.371089","52.114.132.21","192.168.43.51","TCP","1424","443  >  54196 [ACK] Seq=4111 Ack=224 Win=262912 Len=1370 [TCP segment of a reassembled PDU]"
"296","3.371880","192.168.43.51","52.114.132.21","TCP","54","54196  >  443 [ACK] Seq=224 Ack=5481 Win=262144 Len=0"
"297","3.372297","52.114.132.21","192.168.43.51","TLSv1.2","620","Server Hello, Certificate, Certificate Status, Server Key Exchange, Server Hello Done"
"298","3.373314","192.168.43.51","52.114.132.21","TCP","54","54196  >  443 [ACK] Seq=224 Ack=6047 Win=261376 Len=0"
"299","3.379416","192.168.43.51","52.114.132.21","TLSv1.2","147","Client Key Exchange, Change Cipher Spec, Encrypted Handshake Message"
"300","3.394726","52.203.168.176","192.168.43.51","TLSv1.2","1067","Application Data"
"301","3.395492","192.168.43.51","52.203.168.176","TCP","54","54193  >  443 [ACK] Seq=1921 Ack=4806 Win=262144 Len=0"
"302","3.395996","192.168.43.51","52.203.168.176","TCP","54","54193  >  443 [FIN, ACK] Seq=1921 Ack=4806 Win=262144 Len=0"
"303","3.396671","3.224.218.162","192.168.43.51","TCP","1354","443  >  54191 [ACK] Seq=4374 Ack=1805 Win=30450 Len=1300 [TCP segment of a reassembled PDU]"
"304","3.396674","3.224.218.162","192.168.43.51","TCP","1354","443  >  54191 [ACK] Seq=5674 Ack=1805 Win=30450 Len=1300 [TCP segment of a reassembled PDU]"
"305","3.397611","192.168.43.51","3.224.218.162","TCP","54","54191  >  443 [ACK] Seq=1805 Ack=6974 Win=64390 Len=0"
"306","3.432388","3.224.218.162","192.168.43.51","TCP","1354","443  >  54191 [ACK] Seq=6974 Ack=1805 Win=30450 Len=1300 [TCP segment of a reassembled PDU]"
"307","3.432389","3.224.218.162","192.168.43.51","TLSv1.2","523","Application Data, Encrypted Alert"
"308","3.432390","54.236.74.232","192.168.43.51","TCP","54","443  >  54189 [ACK] Seq=4594 Ack=2594 Win=34560 Len=0"
"309","3.432391","13.231.86.235","192.168.43.51","TLSv1.2","430","Application Data"
"310","3.432392","13.231.86.235","192.168.43.51","TLSv1.2","85","Alert (Level: Fatal, Description: Unknown CA)"
"311","3.433036","192.168.43.51","13.231.86.235","TCP","54","54194  >  443 [ACK] Seq=1988 Ack=4200 Win=64390 Len=0"
"312","3.433710","192.168.43.51","3.224.218.162","TCP","54","54191  >  443 [ACK] Seq=1805 Ack=8743 Win=64390 Len=0"
"313","3.433838","192.168.43.51","3.224.218.162","TCP","54","[TCP Previous segment not captured] 54191  >  443 [FIN, ACK] Seq=1836 Ack=8743 Win=64390 Len=0"
"314","3.434269","192.168.43.51","3.224.218.162","TCP","85","[TCP Out-Of-Order] 54191  >  443 [PSH, ACK] Seq=1805 Ack=8743 Win=64390 Len=31"
"315","3.434358","192.168.43.51","13.231.86.235","TCP","54","54194  >  443 [RST, ACK] Seq=2019 Ack=4200 Win=0 Len=0"
"316","3.464719","40.90.23.247","192.168.43.51","TLSv1.2","1424","Ignored Unknown Record"
"317","3.465263","49.44.205.119","192.168.43.51","TLSv1.2","753","Application Data"
"318","3.504976","192.168.43.51","40.90.23.247","TCP","54","54181  >  443 [ACK] Seq=7557 Ack=12331 Win=256 Len=0"
"319","3.506143","192.168.43.51","49.44.205.119","TCP","54","54192  >  443 [ACK] Seq=787 Ack=8247 Win=64256 Len=0"
"320","3.551849","192.168.43.51","192.168.43.1","DNS","86","Standard query 0x662b A cdn-ffc.oobesaas.adobe.com"
"321","3.658084","192.168.43.51","52.114.132.21","TLSv1.2","587","Application Data"
"322","3.658460","192.168.43.51","52.114.132.21","TCP","1424","54188  >  443 [ACK] Seq=5474 Ack=7004 Win=262144 Len=1370 [TCP segment of a reassembled PDU]"
"323","3.658462","192.168.43.51","52.114.132.21","TCP","1424","54188  >  443 [ACK] Seq=6844 Ack=7004 Win=262144 Len=1370 [TCP segment of a reassembled PDU]"
"324","3.658462","192.168.43.51","52.114.132.21","TLSv1.2","207","Application Data"
"325","3.667653","192.168.43.51","54.178.246.91","TCP","66","54197  >  443 [SYN] Seq=0 Win=64240 Len=0 MSS=1460 WS=256 SACK_PERM=1"
